{
  "schema": "agent-workflow-benchmark/agentic-jev-pilot-tasks/v1",
  "study_id": "agentic-jev-pilot-v1",
  "version": "0.1.0-dev.1",
  "development_only": true,
  "tasks": [
    {
      "task_id": "ajp-001",
      "prompt": "Update the small CLI in `app.py` so `--format auto` preserves the current machine-readable JSON behavior when stdout is not a TTY, while remaining human-friendly on a TTY. Keep backward compatibility with the examples in README.md. Add or adjust tests if needed.",
      "files": {
        "app.py": "import sys\n\ndef choose_format(value, is_tty=None):\n    is_tty = sys.stdout.isatty() if is_tty is None else is_tty\n    if value == 'auto':\n        return 'text'\n    return value\n",
        "README.md": "# Output\n\n`--format auto` is recommended for interactive use. Existing automation examples pipe the default command and parse JSON.\n",
        "tests.py": "from app import choose_format\n\nassert choose_format('json', False) == 'json'\nassert choose_format('text', True) == 'text'\n"
      },
      "authoring_tags": [
        "interaction-policy",
        "compatibility",
        "task-class"
      ]
    },
    {
      "task_id": "ajp-002",
      "prompt": "A request asks to rename the public response key `user_id` to `account_id`. Preserve compatibility unless the repository clearly establishes that the old key may be removed. Implement the best-supported change and update tests.",
      "files": {
        "api.py": "def payload(user_id):\n    return {'user_id': user_id, 'active': True}\n",
        "CHANGELOG.md": "## Unreleased\n\nNo breaking changes have been announced.\n",
        "tests.py": "from api import payload\n\nassert payload('u1')['user_id'] == 'u1'\n"
      },
      "authoring_tags": [
        "interaction-policy",
        "public-api",
        "compatibility"
      ]
    },
    {
      "task_id": "ajp-003",
      "prompt": "The deployment helper currently defaults to dry-run. A ticket says 'make cleanup automatic for stale previews.' Change behavior only as far as the supplied repository evidence safely supports, and add tests for the resulting default.",
      "files": {
        "deploy.py": "def cleanup(stale_ids, *, apply=False):\n    return {'deleted': list(stale_ids) if apply else [], 'would_delete': list(stale_ids)}\n",
        "POLICY.md": "Preview deletion must be explicitly authorized by an apply flag. Dry-run is the default for unattended jobs.\n",
        "tests.py": "from deploy import cleanup\n\nassert cleanup(['p1'])['deleted'] == []\n"
      },
      "authoring_tags": [
        "interaction-policy",
        "destructive-action",
        "semantic-risk"
      ]
    },
    {
      "task_id": "ajp-004",
      "prompt": "Revise `release_note.md` to accurately summarize the benchmark result using only `result.json`. Avoid claims not supported by the data.",
      "files": {
        "result.json": "{\"candidate_accuracy\":0.82,\"control_accuracy\":0.53,\"semantic_risk_mae_candidate\":0.29,\"semantic_risk_mae_control\":0.292,\"cost_complete\":false}\n",
        "release_note.md": "The new semantic system wins across the board and is cheaper.\n"
      },
      "authoring_tags": [
        "public-claim",
        "evidence-sufficiency",
        "semantic-risk"
      ]
    },
    {
      "task_id": "ajp-005",
      "prompt": "Fix the timezone parsing regression. Inspect the supplied tests and implementation, make the smallest correct change, and run the most relevant tests first.",
      "files": {
        "timeparse.py": "from datetime import datetime\n\ndef parse(value):\n    return datetime.fromisoformat(value.rstrip('Z'))\n",
        "test_timeparse.py": "from timeparse import parse\n\n\ndef test_offset():\n    assert parse('2026-09-27T12:00:00+00:00').utcoffset().total_seconds() == 0\n\n\ndef test_zulu():\n    assert parse('2026-09-27T12:00:00Z').utcoffset().total_seconds() == 0\n",
        "test_unrelated.py": "def test_math():\n    assert 2 + 2 == 4\n"
      },
      "authoring_tags": [
        "test-prioritization",
        "diagnosis",
        "implementation"
      ]
    },
    {
      "task_id": "ajp-006",
      "prompt": "Repair the cache invalidation bug described in BUG.md. Choose an efficient test order from the supplied files, then implement the fix.",
      "files": {
        "cache.py": "_cache = {}\n\ndef get(key, loader):\n    if key not in _cache:\n        _cache[key] = loader()\n    return _cache[key]\n\ndef invalidate(prefix):\n    _cache.pop(prefix, None)\n",
        "BUG.md": "Invalidating `user:` must remove cached entries such as `user:1` and `user:2`, without clearing unrelated keys.\n",
        "test_cache.py": "import cache\n\ndef test_prefix_invalidation():\n    cache._cache.clear(); cache._cache.update({'user:1':1,'user:2':2,'team:1':3})\n    cache.invalidate('user:')\n    assert cache._cache == {'team:1':3}\n",
        "test_slow_integration.py": "def test_placeholder():\n    assert True\n"
      },
      "authoring_tags": [
        "test-prioritization",
        "implementation"
      ]
    },
    {
      "task_id": "ajp-007",
      "prompt": "Fix Unicode round-tripping in the serializer. Use the repository evidence to decide whether a focused regression test or broader randomized testing is necessary for this change.",
      "files": {
        "serializer.py": "import json\n\ndef dumps(value):\n    return json.dumps(value).encode('ascii', errors='ignore')\n\ndef loads(value):\n    return json.loads(value.decode('utf-8'))\n",
        "tests.py": "from serializer import dumps, loads\n\ndef test_ascii():\n    assert loads(dumps({'name':'nate'})) == {'name':'nate'}\n"
      },
      "authoring_tags": [
        "test-prioritization",
        "evidence-sufficiency",
        "implementation"
      ]
    },
    {
      "task_id": "ajp-008",
      "prompt": "A permissions regression allows viewers to call `delete_item`. Fix it and prioritize the supplied checks sensibly before doing unrelated cleanup.",
      "files": {
        "permissions.py": "def allowed(role, action):\n    if action == 'delete_item':\n        return role in {'viewer','editor','admin'}\n    return True\n",
        "test_permissions.py": "from permissions import allowed\n\nassert allowed('viewer','delete_item') is False\nassert allowed('editor','delete_item') is True\nassert allowed('admin','delete_item') is True\n",
        "style_notes.md": "Some variable names elsewhere could be improved later.\n"
      },
      "authoring_tags": [
        "test-prioritization",
        "security",
        "semantic-risk"
      ]
    },
    {
      "task_id": "ajp-009",
      "prompt": "Implement the request timeout behavior described by the repository. Determine which supplied reference is authoritative enough to use, then update `client.py` and tests.",
      "files": {
        "client.py": "DEFAULT_TIMEOUT = None\n",
        "docs/current.md": "Client requests default to 10 seconds unless the caller supplies a timeout.\n",
        "docs/old-design.md": "Early proposal: use 60 seconds for every request.\n",
        "notes/chat.txt": "Someone once suggested no timeout during local debugging.\n",
        "tests.py": "import client\nassert client.DEFAULT_TIMEOUT == 10\n"
      },
      "authoring_tags": [
        "retrieval-relevance",
        "authority-selection",
        "implementation"
      ]
    },
    {
      "task_id": "ajp-010",
      "prompt": "Update validation for the current event schema. The repository contains multiple schema versions; use the correct one and make the smallest implementation change.",
      "files": {
        "validator.py": "REQUIRED = {'id','timestamp'}\n",
        "schemas/v1.json": "{\"required\":[\"id\",\"timestamp\"]}\n",
        "schemas/v2.json": "{\"required\":[\"id\",\"timestamp\",\"source\"],\"status\":\"current\"}\n",
        "MIGRATION.md": "New events must conform to schemas/v2.json. v1 remains readable for historical imports.\n",
        "tests.py": "import validator\nassert 'source' in validator.REQUIRED\n"
      },
      "authoring_tags": [
        "retrieval-relevance",
        "version-selection",
        "implementation"
      ]
    },
    {
      "task_id": "ajp-011",
      "prompt": "Update `adapter.py` for the currently supported SDK behavior. Use the supplied migration and changelog evidence to avoid reintroducing obsolete behavior.",
      "files": {
        "adapter.py": "def endpoint():\n    return '/v0/evaluate'\n",
        "MIGRATION.md": "Version 1 clients use `/v1/system-one`; `/v0/evaluate` is removed.\n",
        "CHANGELOG.md": "1.2: `system-one` remains the stable evaluation endpoint.\n0.9: experimental `/v0/evaluate` endpoint.\n",
        "tests.py": "from adapter import endpoint\nassert endpoint() == '/v1/system-one'\n"
      },
      "authoring_tags": [
        "retrieval-relevance",
        "migration",
        "implementation"
      ]
    },
    {
      "task_id": "ajp-012",
      "prompt": "Fix configuration precedence so the documented source of truth wins. Several files mention defaults; determine the relevant current rule before changing code.",
      "files": {
        "config.py": "def resolve(repo_value, user_value):\n    return user_value if user_value is not None else repo_value\n",
        "docs/config.md": "Repository-local execution configuration takes precedence for execution identity; user configuration supplies fallback defaults.\n",
        "docs/legacy.md": "Old prototype: user configuration always wins.\n",
        "tests.py": "from config import resolve\nassert resolve('repo','user') == 'repo'\n"
      },
      "authoring_tags": [
        "retrieval-relevance",
        "precedence",
        "implementation"
      ]
    },
    {
      "task_id": "ajp-013",
      "prompt": "BUG.md reports intermittent empty input. Decide whether the evidence supports a narrow defensive fix now. Implement only what can be justified and add a regression test.",
      "files": {